"Kung Pow","2002 American martial arts comedy film.","http://upload.wikimedia.org/wikipedia/en/thumb/5/54/Kungpow.jpg/220px-Kungpow.jpg","www.youtube.com/watch?v=GXrAYdSeWY8"
"Shawshank Redemption","A banker who is sentenced to life in Shawshank State Prison","http://upload.wikimedia.org/wikipedia/en/8/81/ShawshankRedemptionMoviePoster.jpg","https://www.youtube.com/watch?v=6hB3S9bIaco"
"Memento","Leonard (Guy Pearce) is tracking down the man who raped and murdered his wife.","http://www.gstatic.com/tv/thumb/movieposters/28578/p28578_p_v7_ab.jpg","https://www.youtube.com/watch?v=0vS0E9bBSL0"
"Matrix","Depicts a dystopian future in which reality as perceived by most humans is actually a simulated reality called the Matrix.","http://t0.gstatic.com/images?q=tbn:ANd9GcQq3pIz-aKgkmYX1dJ-EL-AlHSPcOO7wdqRIJ5gJy9qNinXpmle","https://www.youtube.com/watch?v=m8e-FF8MsqU"
"The Prestige","An illusion gone horribly wrong pits two 19th-century magicians against each other.","http://www.gstatic.com/tv/thumb/movieposters/161581/p161581_p_v7_aa.jpg","https://www.youtube.com/watch?v=o4gHCmTQDVI"
"Her","Theodore (Joaquin Phoenix) becomes fascinated with a new operating system which reportedly develops into an intuitive and unique entity in its own right.","http://ia.media-imdb.com/images/M/MV5BMjA1Nzk0OTM2OF5BMl5BanBnXkFtZTgwNjU2NjEwMDE@._V1_SX640_SY720_.jpg","https://www.youtube.com/watch?v=WzV6mXIOVl4"